id,name,brand,category,description,price,created_at,updated_at
872305eb-865a-4794-8ed6-e4c8e77c7a08,dream,Smith PLC,Clothing,"Author least behavior court. Increase front about upon.
Talk side culture mention. Mean bill bank answer relate show.",567,2025-01-31T17:17:19.121942,2025-07-23T01:00:06.089489
0ffe5b5d-3814-4aa8-a5fe-326db6ca02e0,college,"Walker, Gallagher and Watkins",Books,Page foreign someone meeting decade by. Me growth beyond can executive federal election perform. Skin last region serve effect white. Today own behavior month adult.,224,2025-10-08T09:05:01.133161,2025-05-02T22:50:44.261359
3549a3f0-a442-43c1-9ea6-db8413593f57,series,Lawson-Johnston,Toys,"Man night manage list. Recently woman table. Guy against quite future.
Because language learn suggest free wide for. Senior authority agree court try end.",305,2025-06-06T18:56:43.455643,2025-03-14T23:09:23.226072
5c3c1937-b2d9-4e35-9fad-dcef5850eda4,them,Rogers and Sons,Electronics,Quickly hundred water account organization. Dinner upon movie money. Difficult citizen green. Social road establish back rate cost mouth.,951,2025-09-22T20:01:54.139508,2024-12-19T18:11:47.397107
ad79283a-4449-4d71-adc9-fffcf0f03457,huge,"Hernandez, Farrell and Roberts",Toys,"Their full create street simple chance.
Send its society service travel. In several teach my process ten treatment water. Perform same research.",638,2025-07-09T03:46:37.067840,2025-04-10T18:34:08.896434
2b881fa5-35fc-42be-ab17-cf0e96c02fd6,remain,Newton-Jones,Furniture,"Tough bring kid however. Language necessary short office yet day very.
Life strategy remain great culture. Amount though page purpose position office such.",167,2025-06-18T07:50:02.644432,2025-08-22T22:34:33.851321
8f4da018-47d5-411a-aec3-6818cc9cd358,window,Keller-Garrett,Toys,"Red worker much and. Design mission travel item player civil.
Almost though guess. Million card lot around. Share cold attention season support choose tell.",431,2025-03-13T20:03:06.823328,2025-04-22T04:24:18.570729
d1dbbb54-f38f-47eb-b36b-34119df73c7d,morning,"Greer, Cook and Hansen",Furniture,"Last hospital you admit relationship. Republican amount none blue however.
American serve find church. Charge your character accept century plan.",653,2024-12-06T15:52:27.746623,2025-05-20T06:30:32.792156
b93c3151-8ba5-47a7-b934-418a20c244e8,ago,Barnes-Cummings,Clothing,"North laugh read. To really lawyer few.
Threat focus word region glass few. Price such group just of along.",907,2025-06-02T23:41:14.649623,2025-01-13T03:48:47.474429
5351c7fe-6416-482d-b44b-4857c4ea8a5c,person,Mitchell-Bullock,Furniture,"See air under station pull.
Dog dog in may season scene in. Prepare drive main garden.
Tough her on. Number but start prepare.
Animal close point book card. Born development call pretty get.",831,2024-12-08T03:32:04.762458,2025-04-21T13:12:51.293253
f5cdbb9b-4f0c-4503-907c-37d0d1dc8a67,include,"Patel, Fisher and May",Furniture,Picture hour similar talk. International detail mouth if themselves question concern. Participant real huge develop job on land. Poor should Mrs upon yes else.,241,2024-11-10T02:58:15.330726,2025-07-15T18:30:47.197971
a0cf132c-46b0-4ff0-b184-fed0e9d42b34,soon,"Little, Brown and Dudley",Electronics,"Week with want seat certainly home war. One office expect.
Attorney dark hope oil hold. Tax cut crime television spend read little.",676,2025-03-16T04:41:27.265223,2025-10-20T00:57:53.892776
4fb0808c-95ac-45e8-bf11-a7689932fb0d,range,Rivera-Moran,Toys,"Yet tax particular worker today. Service about beat recognize describe.
Candidate beyond garden community. Team lose red she tree.",820,2024-12-26T08:13:54.008247,2025-04-30T06:43:23.916624
83b96496-b450-4d23-aaf3-64dad5c0beea,name,Miller-Mueller,Books,Book ask under future assume himself many nature. Accept both condition yard everybody you. Thus onto receive product area loss nor.,397,2025-05-31T09:16:32.759236,2025-03-01T02:12:10.964973
7747532d-a6c5-4960-9b4b-57b3ca3eb9bc,act,Sanders-Murphy,Furniture,Camera series development tell consider feeling. Price chair woman real feel wife.,357,2025-03-04T09:58:13.746188,2025-02-15T10:52:15.040311
ab0cd5ff-4c8b-4167-b217-ecd0085f41bc,specific,Bauer PLC,Clothing,Most report teacher professor. Run piece sea face especially one. Network paper safe across remember ready same production.,231,2024-12-08T08:48:55.788672,2024-11-18T00:30:18.319637
a378d273-abcb-4e83-8d8a-8db357d8967a,gun,Johnson-Stevenson,Electronics,"A green dark term.
Lot food positive blood raise themselves concern. Assume however clear far eight. Range after somebody play message be.",262,2025-07-30T13:55:34.965258,2024-12-31T14:36:11.617257
52aff5cd-656a-451b-88c3-d6856678068e,between,"Williams, Navarro and Sanders",Furniture,Part magazine stay suddenly. Heart prove of size. Play speech opportunity sing modern than garden your.,42,2025-02-23T07:00:01.061497,2025-07-05T16:57:05.950947
fca42126-404a-4db2-bd0d-fd1cb24c7722,hospital,Richardson-Robles,Furniture,"Participant control draw base feel base. Security wall pull address plant wait design.
Week see piece floor wind. Movement future bit firm finish. Share pay maybe quality event.",79,2025-08-09T19:32:47.175814,2025-05-10T12:17:09.839910
7cd44e11-a5de-40f1-bde4-85678c7f581f,think,"Fitzgerald, Middleton and Rogers",Electronics,"Easy agency it third civil. Short recognize recent.
Art necessary course best stop.
Amount produce we put prove part.",806,2025-04-08T03:05:59.022525,2025-08-08T11:38:56.898354
2ceef003-368c-417f-8f9c-00ae1672ccd7,during,Garrison-Rivas,Electronics,"Simple another must security drive individual friend argue. Into thus animal student common.
Quickly general collection human old draw account during.",322,2025-06-21T20:24:49.813365,2024-12-11T01:06:36.041063
cf1ff41c-9fd2-44fa-87d3-66c5f7656023,police,Smith and Sons,Books,"Often question score within big across course.
Some strategy one mouth. Direction certainly so ground.",641,2025-03-31T09:55:27.521383,2025-07-16T17:38:49.747594
5a5b0348-b149-4144-bc41-913e9f7950d8,rock,Walls PLC,Furniture,"Whatever material product realize despite Mr list.
Carry daughter put compare must something. Economic as choice teacher song remain. Card father black those week.",114,2025-02-02T05:37:32.445490,2024-11-27T17:37:52.455909
051fd379-5549-4bc1-b4b8-aa86753ea255,under,"Ingram, Franco and Johnson",Books,"Risk give south not partner already computer. Wife organization I science draw. Not air economic lead.
Chance performance find never wonder others. Debate maybe his. Coach deep sense air.",360,2025-03-16T17:14:50.346852,2025-03-05T00:55:46.527910
d0ffd849-fd71-4e19-8d9b-c20ab272eb0a,walk,"Hill, Watson and Sanders",Electronics,"Find this American film he church. Opportunity media property mouth must.
Baby bed call. Matter a cost myself ability today. Culture more almost prepare thing. Rich mission lay worker bar.",688,2025-04-25T22:51:35.601903,2025-06-01T01:28:02.309384
da96dcc8-d627-4870-97e2-3edecdd34c0d,conference,"Graham, Robinson and Walker",Furniture,"Pattern quite sit. Indeed yes any chance her. Daughter song class north technology authority.
World until character note age. Event part knowledge.
Discussion idea single great admit air president.",113,2025-04-07T19:39:33.708807,2024-11-29T17:38:02.682317
476ef68c-3c0a-4074-8851-f83225299390,baby,White Inc,Furniture,"Add teacher the voice feeling. Great thus whole research.
Science fall return least social father daughter. Order week those lead. Help imagine they ten.",600,2025-08-07T01:04:43.884291,2025-02-20T15:26:59.224419
5e3f4cd3-90c7-44b5-860b-51701d28ea0f,a,Horn Ltd,Books,But table develop by fall trade. Way bill trade raise over should song million. Particular dog yeah order treatment star.,104,2025-07-18T11:24:59.504350,2025-07-08T00:32:51.126080
e8e1f70d-aa78-491d-8b69-ac312b787c54,resource,Madden and Sons,Toys,"Across year wife who. Thousand various growth reflect kid customer.
Role speak tough wind finally couple role. Price machine important Mr attention.",657,2025-04-08T14:46:20.331746,2024-11-11T01:06:19.072622
3116e498-7e77-4776-ba1e-ef0f5c5d089e,year,Lewis-White,Toys,International dream factor bed chance. Shoulder those rich star painting door run language.,242,2025-03-18T09:54:56.172096,2025-04-11T18:58:20.812129
27e6ef5c-3186-44ec-a4c8-8a4536967188,tonight,Zamora LLC,Books,"Health girl follow wife region my.
Without condition have interesting model building. Hour rather improve decade.
Responsibility focus voice. Management these drop subject report.",275,2025-09-17T20:22:26.523543,2025-02-10T08:35:40.821053
453fba9b-c648-4e9d-a07c-ce485e27c144,near,"Wheeler, Mitchell and Simmons",Electronics,"Economy career land for seem indicate court. Draw television after manage firm set.
Behind generation behind really their prepare. Cell people chance assume.",459,2025-04-30T08:14:17.208168,2025-03-11T17:59:40.648248
e3338b36-36e8-4427-8afd-8ffaeb76e4c9,drive,King and Sons,Toys,"Reach benefit share study social part. Body general detail return.
Charge thought of leader will. Shoulder wear writer probably. Boy space study face.",145,2024-12-11T21:02:48.012041,2025-04-01T06:56:41.383813
9c9d5112-2fb0-4456-ada6-177461575225,young,Compton-Mccormick,Furniture,"Into different likely around. Before mind day international. Special network imagine by contain smile company.
Information yes born where. Will impact them keep claim.",297,2025-10-26T22:05:32.704150,2025-07-17T20:43:03.947500
8d696887-8f1b-4b3f-870d-6defb6f44fcc,usually,Moore-Smith,Clothing,"Raise enter ball important admit decade. Campaign cover poor culture responsibility surface person.
Hard where describe apply this. Product production fill.",616,2025-04-01T16:41:27.054052,2025-08-02T05:57:38.789804
541b4a5e-be3f-481f-9a1c-aa9e4cfe4fab,manager,"Evans, Gonzales and Lewis",Clothing,"Leave discuss reduce oil. Only call itself turn ask interesting ball.
Toward reality week too throw law. Cause real style best box establish.",767,2025-01-13T12:39:44.154993,2025-05-09T00:55:09.668883
b0e4af81-7496-488a-9b43-e2106239f83c,should,Burton Group,Clothing,Field cost blue thank rest land. Send always article gas prove.,388,2025-07-24T07:03:43.908500,2025-06-23T12:58:10.783775
ad53499d-80b9-4661-b145-a11b692170fd,ever,James and Sons,Books,"Seven magazine certainly. Team rather medical pick see benefit. Pick court ahead degree message hand film.
Last decide activity nor.",453,2024-11-20T17:51:47.137371,2025-08-09T06:28:16.702263
199280e3-798b-40f5-9569-1ca2187ab053,natural,Butler LLC,Clothing,"Three either easy claim read seat allow nation. Indeed outside cost example.
Surface public pressure traditional economy significant international. Late much mother color.",354,2025-04-28T00:52:07.040051,2025-08-18T17:52:29.872585
0ff26b43-3203-49cb-b7e3-c04a52eae034,street,Mahoney and Sons,Clothing,"Plan local down we.
Range prove five minute act. Evidence arrive loss human team perform us I. Guy event various.
Surface throughout make floor experience address brother. A work seven.",976,2025-07-05T11:34:22.630234,2025-01-20T16:42:43.471122
1a034a12-9e20-4824-9898-e67bb522ca19,whom,Klein-Lee,Furniture,Chair itself model establish these plant wait door. Attorney any personal third important herself experience bag. Politics on American these artist.,837,2025-08-09T15:50:01.531242,2025-10-02T21:35:20.522917
bc8577ae-bcb6-4e1e-86bf-cdf3e5ea7a65,discussion,Osborne Inc,Toys,"Offer wish sure low camera. View entire save father station. Military color why major nice attack.
Choose common determine really. Later professor thank subject grow goal home.",398,2025-07-30T09:24:45.108945,2025-10-16T08:14:50.654440
d788acc2-e209-499e-b56c-8c18fc656952,quickly,Hill Ltd,Furniture,"Plant staff owner just several interesting. Site other talk media generation. Fire bad social occur.
Audience pretty present trip never seven. Meet respond course answer interview full clear.",961,2024-11-18T10:05:51.834700,2025-08-22T10:57:46.784048
5944e45d-06f2-4160-802d-f6e4d1b58357,make,"Stewart, Carlson and Hernandez",Other,"Public thing art suffer evidence sea threat. With list phone film national.
Institution help though capital wife. Have why she make film. Check not live stock five issue leave.",189,2025-06-22T06:06:14.234965,2025-02-18T00:21:01.486710
df55c6bd-99ed-4293-9abd-773e3f33763e,major,"Morris, Haley and Rhodes",Toys,"Environment rest professional director. Program begin single impact wide step movie bit.
Financial front family pressure. Some together director data this list successful realize.",128,2025-03-09T21:39:50.552424,2025-10-02T08:17:29.262003
2f8759a8-2365-4fc7-9ee2-d6b74a0d4dea,exactly,Harrell-Harris,Toys,Tax high yes. Listen citizen item ever guess. President somebody eat exist place treatment green.,953,2024-12-14T09:25:37.562828,2025-10-05T06:32:58.549498
b291c7ed-445d-444a-b7d1-ab7eb4df4660,then,Roy-Adams,Clothing,"Action magazine it. Their me lead such wide police.
Past although couple while. General left large level.
Site push lawyer. Tell line story provide. Media PM morning tough require project.",168,2025-06-02T13:58:13.916716,2025-06-06T01:44:28.154248
ba8b579c-dc87-4d53-bd66-993bd7b3567e,suggest,Gonzales Group,Books,Allow director employee choose. Article stay life democratic. Although guess deal century ok. Appear democratic decade discuss if issue.,971,2025-02-21T16:36:59.564703,2025-10-16T08:12:58.199743
3c523c84-5b49-4b39-804d-5ffb4f7e4bb7,decision,Hayes and Sons,Other,"Whether down each responsibility by. Discover seem student nature.
Baby indicate hard true. Professor front front prepare. Win collection movement section thing policy experience.",344,2025-05-01T23:14:36.694670,2025-04-03T23:29:31.072999
c6a9a154-8949-44a2-837e-9995cba4bd57,do,Brown PLC,Furniture,"Difficult news purpose particularly goal let song. Identify participant behavior receive as.
Wear practice travel expect. Majority month husband realize. Organization traditional shoulder seem.",693,2025-04-09T13:32:44.874134,2025-07-23T13:01:59.771322
e028bed2-6931-4acf-bce9-d00a71d152e9,kitchen,Nixon-Mccann,Toys,"Majority indeed control effect.
Film open ok not kind career. Challenge natural relationship.",422,2024-12-23T01:11:33.015911,2024-11-21T13:00:10.258669
4dc8f406-1b67-4c67-911a-945ca532e015,fill,Acosta LLC,Toys,"Degree catch person cell media soldier still. Network method beat shoulder.
But value knowledge strong listen. Goal weight eat account ago lay single.",427,2025-03-02T04:58:55.896432,2025-08-28T05:37:43.900651
d57314c6-f151-4c01-b9bb-02d13bed0f7e,case,"Adams, Parker and English",Furniture,Order six radio serve member others pressure. Here past American matter friend.,504,2024-12-22T18:50:48.392619,2024-11-02T01:59:33.652655
697c4efb-9094-45b6-900d-0ccf98ebc3b7,difficult,Kent-Brown,Furniture,"Turn high first out. Per rock school people rest.
Back seven his quite card toward. Ahead business cup nice manager do. Spring message television age. Listen gun network final institution.",778,2025-08-22T00:29:37.535936,2025-04-25T05:41:23.065058
2f7d6be3-726e-4b1f-acaa-2e3941bb21c1,property,"Ingram, Compton and Gilmore",Other,"Right skill up expect close. Note just city early cut news suggest market. High she one.
Man station trade sea individual art.",881,2025-09-05T17:25:01.407604,2025-05-15T02:42:29.162092
9823b082-8ae3-4433-9151-74d35fc0c420,seat,Garcia Ltd,Toys,Home recognize memory attorney next clear. Now beyond officer hair approach culture spring. High artist hospital future.,288,2025-07-28T03:11:55.682023,2025-10-16T08:52:55.115074
2eb9e1dd-3a60-4917-aa93-ce163b5b744b,say,Carter-Lucero,Furniture,"Arm brother conference. Local meet deep commercial receive.
Option single anything evening responsibility spend. Way character never test seat. On attorney such civil news paper option while.",86,2024-10-29T07:40:24.809382,2025-10-11T09:14:31.643258
fd613b47-1239-4173-a773-6980061c5d17,lose,"Payne, Baker and Gordon",Electronics,Leader million whose too tree bed. Situation office identify them new street market. Final method truth billion picture use. Easy hope hair perhaps.,346,2025-02-08T23:15:46.768332,2025-08-14T09:29:44.415437
866df8aa-0cfa-4611-ac9b-c38817da6ae2,always,Barber-Mccarthy,Electronics,Figure candidate conference meet attack save. Poor player product skill. Several go around trip example sign.,437,2025-01-21T08:56:48.167694,2025-10-20T12:37:34.714794
78644d95-bf0d-404a-b364-6b3e603824f5,time,Roberson and Sons,Furniture,Operation walk prevent little magazine interview without. Card son but across word. Business people day ask. Air pick impact girl five guess.,38,2025-02-21T09:41:38.860683,2025-03-18T10:26:58.383781
c12b6054-e810-466c-89fe-ad8c7cf3e615,enter,"Castillo, Wolf and Stephenson",Electronics,"Walk floor water since watch interesting catch. Any opportunity firm Mrs trade study water.
Generation study nothing arm huge score ask four. Visit detail near behind election instead who.",982,2025-10-23T15:13:57.618323,2025-02-07T23:15:02.077487
79229d29-7226-4509-acf6-33f8c183a27a,always,Obrien-Alvarez,Electronics,Run product daughter risk. Site party specific cup. Never magazine customer personal sound seek.,223,2025-06-18T21:27:59.477409,2025-02-03T20:02:09.371721
16ec5b40-d3b6-462b-8b5e-57c3c66ecc8a,your,Burgess Inc,Other,"Wife away need deep back of red sometimes.
Painting approach last. Pressure nor response method. Catch shoulder happen push use work.",282,2025-05-03T00:16:07.185458,2025-05-11T09:41:14.763211
e40945dc-4226-492d-a358-dccefa46172d,develop,Martinez-Steele,Electronics,"Common together bed can. Tonight teacher important option study top choose include. Buy book article either space.
Man people rich seem bill. He study ahead station service but.",404,2025-08-03T18:34:19.696151,2025-08-01T04:26:26.102990
ea84bcf0-cb68-479c-b982-cf2f7ae16cf4,visit,Huff-Todd,Furniture,"Citizen today with source machine. Join enough religious. Five probably risk Mrs. Health tend authority dark.
Behavior talk find. Science cost cause issue.",266,2025-01-07T22:52:07.440992,2025-01-23T19:29:42.362603
1283d24f-6b00-421b-9456-2bc4273c9b93,whole,"Burke, Walters and Smith",Other,"Research once part stock value shake. In exist available avoid political trip floor. Six medical for meet.
Thank doctor policy hard. Region everybody apply increase article scene want.",556,2025-02-02T09:27:39.986817,2025-09-19T17:33:18.982335
e0523ba2-5d4b-448e-be35-1fa58d920821,campaign,Hanson-Mitchell,Books,"Hit positive right word once. Technology home with partner skin group right.
Evening course name show eat key commercial.",60,2025-09-21T16:22:15.157474,2025-03-05T05:36:09.055248
b31412ed-1c4f-4f17-adae-4994724d16d8,hundred,Morgan LLC,Toys,Need process check specific base. Simple should go doctor floor kitchen order. Your individual determine meet itself.,353,2025-05-01T21:04:14.894876,2025-10-26T06:09:40.308192
8a108d97-333e-4506-bf53-b40febe054d4,human,"Salinas, Martin and Walker",Books,Become management agent already professor cover director. Themselves individual ask car. Popular free day others.,784,2025-02-15T05:47:29.763811,2025-08-11T07:30:03.458343
515ef5e4-e99a-4805-af04-aa5c1aec3329,claim,Richardson Group,Other,"Program say father after. No life wall indicate. Painting tend argue party network figure law.
Tonight adult set.
Certainly social town hope dark such. Professional lot market arm.",78,2025-02-08T23:45:35.864914,2025-06-05T03:16:34.248410
32cf8fb3-9063-4b34-bf77-7bcace2be513,sure,Moreno Group,Other,Newspaper president organization work economic her film hold. Research pretty network. Seem go environment TV remember employee lay help.,386,2025-03-31T02:48:14.151433,2025-09-02T22:05:13.123548
78fd92af-be61-45fc-af48-5112b7452681,college,Hammond LLC,Toys,"Customer man security through. Check wrong store small. Accept work challenge increase only today minute.
Nothing no red woman between join important miss. Foreign if institution.",199,2025-05-01T09:10:38.731603,2025-03-09T02:47:54.146371
74c38aa2-f516-4427-8b2c-0030aeb6592c,agree,"Miller, Dominguez and Patel",Toys,Mrs your into season property force method. Plant rich pattern scene. Miss effect case action turn. Forget ever type.,292,2025-06-07T18:54:10.284778,2025-05-26T18:12:34.990626
5e83e9e5-4098-41bf-87b6-a78235b9abb2,body,Erickson-Smith,Clothing,Source describe fine southern such. Order picture decide everything relationship individual not. Cover begin certain ago throw. Attack save example produce.,539,2025-03-04T17:23:42.861481,2025-01-22T00:44:56.362379
7731b439-91df-4980-892a-3ace0055c3ee,defense,Brooks-Gray,Clothing,Without analysis stand usually. Fast bring check detail work. North at that including mother.,579,2024-12-29T13:07:17.286079,2025-10-09T10:33:10.414192
cb621098-8068-4d7e-bb3e-aaacb61d9151,sport,"King, Duke and Combs",Books,"Clearly control none look evidence common at part. Sit tax central turn sell impact real.
Get book manage matter property wrong hope.",120,2025-03-01T21:10:30.801287,2025-05-25T01:13:44.837948
2e4de5a9-650c-45ab-8084-39e2ee5eaa0e,chance,Bell-Fitzgerald,Other,"Become value involve company he among. American tree nor institution. Window within peace successful exist everything.
Customer property concern step gun movement. Put beyond above serve keep.",369,2025-03-06T01:17:00.872311,2025-05-01T10:24:32.328266
68963494-4995-416d-a1f2-289ccea06ced,least,Clark PLC,Clothing,Two sense open despite school program wind action. Safe not skill identify laugh major network. Letter age since.,882,2025-01-15T21:04:02.328734,2025-10-03T23:48:59.857477
ef0a1813-819b-421f-80ac-94ae54131725,ever,Gordon-Gonzalez,Other,"Stuff change phone line property. However movement field three wife trade.
Model respond gas feel. Ask push beautiful site moment once.",92,2025-06-04T19:59:42.653256,2025-04-06T14:18:42.367193
c0e95a03-25e7-4082-bb11-95ce6d5a32ab,anyone,"Floyd, Thompson and Price",Furniture,"Teacher sign challenge project alone. Eat camera within police include matter space.
Could leave mention arrive final until success. Would political require task plan must deep.",52,2025-01-02T08:45:32.438745,2024-12-29T10:50:30.513748
df46937f-f7d7-4dcb-b3c9-e2fda6076efe,stock,Watson Ltd,Toys,"Road paper unit success word section. Major many three might. Sure southern control current put. Deep American somebody kind whether.
Above life how about the.",967,2025-02-21T09:13:09.083558,2025-02-06T08:44:26.360477
3a0d1bc3-e5b0-4ecb-98d6-734aadc577db,especially,Blackwell and Sons,Books,"Appear order political address. Expect carry knowledge whole.
Determine brother natural serious you force describe be.
Respond hard doctor wide attack million. Bed put college.",431,2025-04-03T02:27:48.271305,2024-11-28T21:04:32.262751
173668c9-0f65-4fac-9293-0c9017a35ca6,spend,Yang Group,Electronics,Any rich research economy throughout. How no to against all land. Kid consider area national whatever.,185,2025-10-17T04:05:02.650666,2025-08-12T05:28:12.260046
8f5cb09c-47f4-4434-b1cc-8efad56152c0,strategy,"Mckinney, May and Taylor",Furniture,"Watch set after. Food stop themselves difference.
Contain pressure score big everything movie beyond course. Process beat any apply give fire. Sister Mrs kid inside.",379,2024-11-21T04:22:53.129281,2024-12-25T14:35:17.145028
e3136a96-3da2-43be-b93a-b15e45a7035c,one,Banks LLC,Clothing,"Discover ability meet successful like mind let. Hair weight threat.
Central growth fall near open. Choose look guy visit near beautiful cold sea. Rule learn arrive individual official.",238,2024-12-10T17:36:16.483859,2025-02-03T08:33:33.431434
ff5dc410-ccf5-48b5-9078-0c86b576bc8b,oil,Huber-Barnes,Furniture,Read various majority movement policy individual. Star play last responsibility standard. Newspaper enter budget likely.,838,2025-08-16T08:16:43.387964,2025-05-24T01:35:51.199777
f7008327-4f4d-4c3b-a590-c69f70170dc1,sign,Miller-Miller,Toys,Indeed treat public four simple year yard. Drop reason particular official maybe drop manage. Want middle smile class. Idea themselves get man physical two.,781,2025-08-20T00:15:59.911558,2025-04-03T02:25:52.980242
305363a1-e20c-4146-9f08-c50d4a10af52,hundred,Wilson-Castaneda,Electronics,Same interest ready bar policy. Everybody mouth civil value good allow easy hold. Why baby dog dark.,100,2024-11-28T21:03:06.963985,2025-10-18T08:58:45.935035
6c116be7-7d9a-4da3-a15e-d26af28a44f7,in,Parker-Oliver,Clothing,"As option staff more street me when let.
Because marriage determine month. Me small themselves back.",557,2024-11-23T09:22:38.596321,2025-04-18T12:07:09.162896
432c70b9-b3dd-463d-8172-d39873291fa9,scene,Cole-Charles,Clothing,"Form where local. State director direction church.
Response computer level right gun huge company. Close likely be player relationship raise we. Remain though prepare.",910,2025-02-27T10:13:16.004993,2025-09-19T05:22:49.510239
106ad9fc-14ba-46ab-a688-05c9c091c1e1,fill,Nguyen-Ortega,Other,"One begin hundred may large research. Magazine specific nature couple most sense same.
Fly same something lay according theory natural. Near TV actually. Few quality popular top year.",282,2025-09-07T11:15:11.394581,2025-02-03T22:06:40.547888
40998bc4-4b70-4c7c-9aae-a69cf78d268e,trouble,Kennedy and Sons,Furniture,Board animal shake as whatever claim rest. Large mission give example interview listen. Street out sister do.,869,2025-05-15T17:12:16.789234,2024-12-10T06:18:13.910290
910937f8-2375-4b4c-a32c-ae03b8f5b010,those,"Green, Morgan and Park",Books,"Plan example control population outside recent although. Beat throughout special my.
Particular consider science exactly will. Item eight physical share.",298,2025-03-16T20:21:58.514729,2025-08-10T14:56:12.570504
